{
  "horse_id": "924282",
  "horse": "example-value",
  "age": "example-value",
  "sex": "example-value",
  "number": "example-value",
  "position": "example-value",
  "draw": "example-value",
  "weight": "example-value",
  "weight_lbs": "example-value",
  "headgear": "example-value",
  "or": "example-value",
  "jockey": "example-value",
  "jockey_id": "466269",
  "trainer": "example-value",
  "trainer_id": "968475",
  "owner": "example-value",
  "owner_id": "313489",
  "sire": "example-value",
  "sire_id": "974847",
  "dam": "example-value",
  "dam_id": "589356",
  "damsire": "example-value",
  "damsire_id": "946086"
}